{
  "version": "1.2.0",
  "fechaCorte": "2026-07-11",
  "sistema": {
    "ejeX": "propiedad-mercado",
    "ejeY": "autoridad-politica",
    "alcance": "Atlas educativo de posiciones relativas adaptado a España. Sus coordenadas son un prior editorial auditable: no sustituyen el perfil por facetas, la evidencia doctrinal, el periodo ni las diferencias decisivas entre corrientes vecinas.",
    "subdimensionesX": {
      "titularidad": ["dr-001", "eco-002", "eco-012", "lab-017"],
      "control-productivo": ["lab-016", "lab-017"],
      "coordinacion-mercado": ["izq-005", "ene-005", "lib-008", "eco-005", "eco-010", "eco-011", "eco-013"],
      "propiedad-difundida": ["eco-006", "eco-009", "eco-014"]
    },
    "familiasY": {
      "contrapesos": ["der-026", "dem-006", "dem-007", "dem-008", "dem-009", "dem-010", "dem-019", "dem-020", "dem-026", "dem-027", "dem-028", "dem-031"],
      "libertades-coercion": ["izq-044", "dem-021", "dem-022", "dem-023", "rel-001", "rel-002", "rel-003", "lim-002", "lim-003", "lim-005", "lim-006", "lim-007", "soc-001", "soc-003", "soc-006", "lab-015"],
      "jerarquia-organizacion": ["izq-002", "izq-003", "izq-007", "izq-018", "izq-038", "izq-039", "dem-015", "dem-017", "lim-001", "lab-005", "lab-006"],
      "participacion-revocacion": ["dem-001", "dem-002", "izq-037", "dem-013", "dem-014", "dem-029"]
    },
    "familiasNucleoY": ["contrapesos", "libertades-coercion"]
  },
  "referenciaVisual": {
    "url": "https://preview.redd.it/where-do-you-fall-on-this-very-detailed-political-compass-v0-9bw9g7zxfns91.jpg?auto=webp&s=ca1d9e02f5d9124aed36dd80723b88d9b2171136",
    "sha256": "5a10ac569b54cf9718e63a01bdaacd35b1bf1c6528e43e7ab33cd4173f79e35b",
    "papel": "prior-visual-relativo",
    "licenciaUso": "La imagen se usa únicamente como prior de composición y posición relativa; no se redistribuye ni se copian sus memes, ficción, colores, texto o geometría exacta como activo del producto."
  },
  "umbrales": {
    "minimoCorrientes": 90,
    "minimoInstrumentadas": 40,
    "minimoFamilias": 16,
    "minimoPorCuadrante": 15,
    "minimoItemsX": 6,
    "minimoSubdimensionesX": 3,
    "minimoItemsY": 6,
    "minimoFamiliasY": 3,
    "minimoItemsNucleoY": 2,
    "maximaDistanciaSinJustificar": 25,
    "maximaDistanciaConJustificacion": 60,
    "maximaDistanciaMotorSinJustificar": 25,
    "maximaDistanciaMotorConJustificacion": 120,
    "maximaAreaRegionPorcentaje": 4.5,
    "maximoRadioVacio": 60
  },
  "reglasDuras": [
    {"id":"MAP-01","regla":"Toda corriente visible tiene definición española, familia, periodo o variante cuando proceda y preguntas discriminantes neutrales.","verificacion":"Validar campos y resolver todos los ids de preguntas."},
    {"id":"MAP-02","regla":"Una corriente A puede ser región principal y toda B aparece al activar profundidad; ninguna doctrina seria se oculta en una categoría de descarte.","verificacion":"Filtrar por decisión y comprobar que la capa exhaustiva contiene todas las corrientes A y B."},
    {"id":"MAP-03","regla":"Solo ficción, memes, contradicciones sin corpus y nombres imposibles de interpretar quedan fuera; una doctrina, movimiento o modelo real puede ser región exhaustiva si su ficha declara límites y solapamientos.","verificacion":"Ninguna exclusión puede existir dentro de corrientes y cada inclusión no integral debe advertir que funciona como faceta o contexto."},
    {"id":"MAP-04","regla":"Alejar una corriente más de veinticinco puntos del prior requiere justificación; superar sesenta solo se admite en una sustitución con revisión editorial doble registrada.","verificacion":"Conservar el prior original, calcular la distancia y exigir justificación y revisión doble cuando corresponda."},
    {"id":"MAP-05","regla":"Propiedad exige seis anclas, tres subdimensiones y ninguna subdimensión sostenida por un solo ítem antes de usar coordenada del motor.","verificacion":"Auditar titularidad, control productivo, coordinación y propiedad difundida."},
    {"id":"MAP-06","regla":"Poder exige seis ítems independientes y tres familias, incluida evidencia de pluralismo institucional o libertades civiles.","verificacion":"Contar ids únicos y no sumar dos veces el mismo ítem."},
    {"id":"MAP-07","regla":"Una referencia violenta nunca produce identidad, porcentaje lúdico, recomendación ni contenido operativo y exige advertencia reforzada.","verificacion":"Comprobar sensibilidad, texto visible y regla de publicación."},
    {"id":"MAP-08","regla":"Solo una doctrina integral con publicación geométrica explícita participa en Voronoi; las fichas en investigación siguen visibles como anclas huecas sin poseer celda ni cercanía.","verificacion":"Calcular Voronoi solo con regiones publicadas y comprobar que toda región en investigación queda bloqueada."},
    {"id":"MAP-09","regla":"Área, densidad por cuadrante y radio vacío son diagnósticos de cobertura, nunca cuotas que permitan inventar, desplazar o publicar una corriente para rellenar el plano.","verificacion":"Informar áreas, vacíos y cuadrantes como avisos reproducibles sin convertir sus umbrales en puertas de validez doctrinal."},
    {"id":"MAP-10","regla":"Toda fuente no disponible en español indica de forma visible el idioma real del recurso enlazado.","verificacion":"Auditar fuentes marco y fuentes de cada posición."},
    {"id":"MAP-11","regla":"Toda corriente histórica o extranjera visible declara país y periodo en su nombre o encaje y conserva preguntas discriminantes útiles, sin presentarse como identidad contemporánea española.","verificacion":"Auditar contexto temporal y geográfico, preguntas existentes y cautela explícita en cada ficha."}
  ],
  "exclusiones": [
    {"etiquetaOriginal":"Hive Mind Collectivism","capa":"exclusion","motivo":"Ficción especulativa de comunidades de memes, sin tradición política delimitada ni fuentes aptas para un resultado personal.","tipo":"meme-ficcion"},
    {"etiquetaOriginal":"Ingsocism","capa":"exclusion","motivo":"Ideología ficticia de la novela 1984; conservarla como celda normalizaría ficción como opción política real.","tipo":"meme-ficcion"},
    {"etiquetaOriginal":"Death Worship","capa":"exclusion","motivo":"Rótulo ficticio de 1984 sin doctrina histórica independiente ni utilidad para el matching español.","tipo":"meme-ficcion"},
    {"etiquetaOriginal":"CapCom","capa":"exclusion","motivo":"Abreviatura internética ambigua y contradictoria sin referente doctrinal estable que permita asignar posiciones.","tipo":"ambigua"},
    {"etiquetaOriginal":"Anarcho Fascism","capa":"exclusion","motivo":"Cruce de internet sin tradición estable; sus proposiciones reales deben medirse por autoridad, propiedad y violencia.","tipo":"meme-ficcion"},
    {"etiquetaOriginal":"Anarcho Monarchism","capa":"exclusion","motivo":"Cruce internético sin cuerpo doctrinal delimitado; monarquía simbólica y antiestatismo se miden por separado.","tipo":"meme-ficcion"},
    {"etiquetaOriginal":"Anarcho Posadism","capa":"exclusion","motivo":"Meme que combina ramas incompatibles; el Posadismo histórico y los anarquismos serios permanecen separados.","tipo":"meme-ficcion"},
    {"etiquetaOriginal":"Soulism","capa":"exclusion","motivo":"Creación de comunidades polcompball sin corpus académico o político estable para una aplicación seria.","tipo":"meme-ficcion"},
    {"etiquetaOriginal":"Avaritionism","capa":"exclusion","motivo":"Ideología meme de foro sin tradición documentada y sin preguntas neutrales que aporten información política real.","tipo":"meme-ficcion"},
    {"etiquetaOriginal":"True Anarchism","capa":"exclusion","motivo":"Etiqueta de exclusión o gatekeeping, no una corriente; se sustituye por ramas anarquistas documentadas.","tipo":"meme-ficcion"},
    {"etiquetaOriginal":"Anti Communism","capa":"exclusion","motivo":"Rechazo transversal compartido por doctrinas incompatibles y por motivos distintos; no determina una alternativa positiva.","tipo":"rasgo-transversal"},
    {"etiquetaOriginal":"Centrism","capa":"exclusion","motivo":"Posición relacional o estrategia de moderación, no un paquete doctrinal estable que merezca región propia.","tipo":"rasgo-transversal"},
    {"etiquetaOriginal":"Pink Capitalism","capa":"exclusion","motivo":"Estrategia comercial y coalición entre mercado y derechos LGTB, no corriente política integral estable.","tipo":"rasgo-transversal"},
    {"etiquetaOriginal":"Neo Bolshevism","capa":"exclusion","motivo":"Ideología ficticia de Eurasia en la novela 1984; no equivale al bolchevismo histórico ni a sus ramas políticas documentadas.","tipo":"meme-ficcion"},
    {"etiquetaOriginal":"Monarcho Communism","capa":"exclusion","motivo":"Cruce especulativo sin corpus político estable; una jefatura monárquica y cada modelo de propiedad comunista se miden por separado.","tipo":"meme-ficcion"},
    {"etiquetaOriginal":"State Liberalism","capa":"exclusion","motivo":"Etiqueta propia de comunidades de memes sin uso doctrinal estable; liberalismo político, economía mixta y autoridad estatal ya se representan como facetas independientes.","tipo":"meme-ficcion"},
    {"etiquetaOriginal":"Banana Republicanism","capa":"exclusion","motivo":"Sátira sobre repúblicas dependientes o capturadas, no una ideología defendida; la captura institucional queda descrita mediante corporatocracia, cleptocracia y calidad democrática.","tipo":"meme-ficcion"},
    {"etiquetaOriginal":"Astro Libertarianism","capa":"exclusion","motivo":"Construcción especulativa de comunidades de memes sin tradición política delimitada ni aplicación española verificable.","tipo":"meme-ficcion"},
    {"etiquetaOriginal":"Antifa","capa":"exclusion","motivo":"Red plural de movimientos y tácticas antifascistas, no una doctrina integral única; antifascismo, violencia, pluralismo y estrategia se miden por separado.","tipo":"rasgo-transversal"},